{
  "$schema": "../adr-0009-decision-review.schema.json",
  "schema_version": 1,
  "review_id": "ADR0009.DECISION_REVIEW.NOCLAIM_TEMPLATE.2026_07",
  "status": "no_claim_decision_review_template",
  "updated": "2026-07-18",
  "claim_status": "ADR-0009 decision-review template only; no Servo source strategy, no source baseline, no feature profile, no owner-selected option, no dependency approval, no component approval, no JavaScript-runtime change, no source import, no source adoption, no compatibility claim, no performance claim, no security claim, no support commitment, no release-code authorization, no PB-002 readiness promotion, and no implementation claim.",
  "source_records": [
    "docs/project-buildout/09-servo-adoption-decision-framework.md",
    "docs/project-buildout/14-adr-0009-source-strategy-decision-packet.md",
    "docs/project-buildout/15-adr-0009-evidence-traceability-matrix.md",
    "docs/project-buildout/16-adr-0009-decision-draft.md",
    "docs/blueprint-v1/machine/adr-0009-evidence.schema.json",
    "docs/blueprint-v1/machine/adr-0009-evidence.json",
    "docs/blueprint-v1/machine/adr-0009-decision-review.schema.json",
    "docs/blueprint-v1/machine/adr-0009-decision-reviews/no-claim-decision-review-template.json",
    "docs/blueprint-v1/machine/pre-build-readiness.json",
    "docs/blueprint-v1/machine/build-readiness-task-queue.json",
    "docs/blueprint-v1/machine/research-readiness-crosswalk.json",
    "docs/blueprint-v1/17-architecture-decisions.md",
    "docs/blueprint-v1/20-definition-of-done.md",
    "docs/research/servo-source-strategy-inventory-2026-07.md",
    "docs/research/servo-component-boundary-analysis-2026-07.md",
    "docs/research/servo-local-compatibility-corpus-2026-07.md",
    "docs/research/servo-performance-baseline-2026-07.md",
    "docs/research/servo-security-maintenance-implications-2026-07.md",
    "tools/validate_adr_0009_evidence.py",
    "tools/validate_blueprint.py",
    "tools/check.ps1"
  ],
  "review_scope": {
    "selected_option": null,
    "source_baseline": null,
    "feature_profile": null,
    "owner_reviewer": null,
    "independent_reviewer": null,
    "review_status": "template_only_no_decision",
    "prohibited_placeholder_policy": "Template records must not name placeholder options, title-only reviewers, self-approval, private contact details, implied source adoption, or inferred owner authority; a real decision review must replace null fields with owner-reviewed evidence."
  },
  "decision_status": {
    "owner_selected_option": false,
    "source_baseline_selected": false,
    "feature_profile_selected": false,
    "evidence_items_closed": false,
    "exceptions_approved": false,
    "public_claim_diff_applied": false,
    "support_language_updated": false,
    "pb002_unblocked": false,
    "source_import_authorized": false,
    "servo_source_strategy_accepted": false,
    "component_approval_granted": false,
    "release_code_authorized": false
  },
  "evidence_axes": [
    { "axis": "ADR9-EV-001 source identity and checkout trust", "required_evidence": "Owner-selected source baseline, signed-tag or equivalent provenance decision, accepted source equivalence policy, blob and legal review, and rerun plan.", "template_status": "missing in template" },
    { "axis": "ADR9-EV-002 reference build reproduction", "required_evidence": "Owner-accepted replay protocol, clean-target reproduction on an independent host or clean VM, target/cache isolation replay, and retained success/failure logs.", "template_status": "missing in template" },
    { "axis": "ADR9-EV-003 dependency and SBOM posture", "required_evidence": "Owner-selected SBOM format/toolchain, full SBOM, advisory snapshot, duplicate-version decisions, and generated/native inclusion rules.", "template_status": "missing in template" },
    { "axis": "ADR9-EV-004 license notice patent source-offer decisions", "required_evidence": "Turing-specific license, advisory, notice, patent, source-offer, and redistribution decisions for the selected baseline.", "template_status": "missing in template" },
    { "axis": "ADR9-EV-005 native package policy", "required_evidence": "Native source-build recipes or binary-package exceptions, notice/advisory review, package minimization, and final package manifest.", "template_status": "missing in template" },
    { "axis": "ADR9-EV-006 native bootstrap provenance", "required_evidence": "Deterministic native bootstrap download verification policy, independent replay, provenance review, and redistribution decision.", "template_status": "missing in template" },
    { "axis": "ADR9-EV-007 unsafe and native code classification", "required_evidence": "Block-level unsafe ledger, native/FFI/generated reachability, focused evidence, and owner-reviewed risk disposition.", "template_status": "missing in template" },
    { "axis": "ADR9-EV-008 generated output and build-script policy", "required_evidence": "Clean generated-output regeneration, source/license provenance, accepted side-effect policy, dynamic tracing, and proc-macro provenance review.", "template_status": "missing in template" },
    { "axis": "ADR9-EV-009 FFI ABI contracts", "required_evidence": "Accepted FFI ABI contracts, ownership, conformance tests, sanitizer/fuzz/Miri or equivalent evidence, and release-boundary decisions.", "template_status": "missing in template" },
    { "axis": "ADR9-EV-010 source archive and upstream provenance", "required_evidence": "Selected source/archive equivalence, upstream release comparison, independent-source verification, and provenance exceptions.", "template_status": "missing in template" },
    { "axis": "ADR9-EV-011 candidate component boundaries", "required_evidence": "Owner-selected option, source baseline, feature profile, target platform, dependency closures, in/out component lists, accepted APIs, replacement contracts, and maintenance boundaries.", "template_status": "missing in template" },
    { "axis": "ADR9-EV-012 JavaScript-runtime conflict analysis", "required_evidence": "Owner-reviewed option-by-option JavaScript impact decision, no-JIT proof, SpiderMonkey dependency analysis, Web IDL plan, GC/wrapper/realm model, DevTools impact, and Test262 strategy.", "template_status": "missing in template" },
    { "axis": "ADR9-EV-013 compatibility corpus and WPT/Test262 evidence", "required_evidence": "HTTPS harness execution, host-alias browser runs, raw logs, focused WPT subset, disabled/expected/timeout/crash/unsupported accounting, failure denominator, flakiness policy, and Test262 plan.", "template_status": "missing in template" },
    { "axis": "ADR9-EV-014 fixed-hardware performance and memory baseline", "required_evidence": "Runner-generated local corpus baseline, raw samples, hashes, owner-approved hardware/OS image, lifecycle disclosure, memory metrics, startup/input/frame/CPU/wakeup/energy measures, and equal-workload denominator.", "template_status": "missing in template" },
    { "axis": "ADR9-EV-015 security model and sandbox implications", "required_evidence": "Owner-reviewed process authority map, sandbox boundary deltas, negative sandbox tests, identity preservation, native/media/GPU/runtime/update risk review, and compromised-process evidence.", "template_status": "missing in template" },
    { "axis": "ADR9-EV-016 maintenance and upstream relationship", "required_evidence": "Owner-approved patch ownership, upstream cadence policy, security response, merge burden, breakage handling, rollback plan, and primary/backup owners.", "template_status": "missing in template" },
    { "axis": "ADR9-EV-017 public claims requirements risks support impact", "required_evidence": "Owner-selected option, document and registry diff, final unsupported behavior, residual risk, support language, and claim boundaries.", "template_status": "missing in template" },
    { "axis": "ADR9-EV-018 ADR decision and review", "required_evidence": "Accepted, rejected, or superseded ADR text with owner approvals, rejected options, time-bounded exceptions, and post-decision work packages.", "template_status": "missing in template" }
  ],
  "option_axes": [
    { "axis": "Option A clean implementation informed by Servo", "required_evidence": "Owner review preserves independent-engine claims while treating Servo only as external research input.", "template_status": "not selected in template" },
    { "axis": "Option B selective Servo components", "required_evidence": "Owner review names accepted components, excluded components, source baseline, dependency closure, replacement contracts, support language, and residual risks.", "template_status": "not selected in template" },
    { "axis": "Option C upstream-first collaboration", "required_evidence": "Owner review defines contribution policy, patch ownership, review expectations, evidence-ingestion boundaries, and disclosure coordination.", "template_status": "not selected in template" },
    { "axis": "Option D Servo-derived engine", "required_evidence": "Owner review rewrites charter, JavaScript runtime, dependency, security, support, release, maintenance, and public claim records before any Servo-derived claim.", "template_status": "not selected in template" },
    { "axis": "Option E explicit Servo browser charter change", "required_evidence": "Owner review rebuilds product identity, market strategy, requirements, risks, roadmap, support, governance, release, and security boundaries.", "template_status": "not selected in template" }
  ],
  "owner_review_axes": [
    { "axis": "owner-selected option", "required_evidence": "Named owner selects, rejects, or supersedes exactly one ADR-0009 direction with rationale.", "template_status": "not owner-reviewed in template" },
    { "axis": "source baseline and feature profile", "required_evidence": "Named owner selects source baseline, feature profile, target platforms, and rerun rules.", "template_status": "not owner-reviewed in template" },